{
  "$schema": "https://json-schema.org/draft/2020-12/schema",
  "$id": "https://yki.local/schema/v1.json",
  "title": "Yo-kai Watch U YKI build configuration",
  "description": "Paths are relative to this JSON file. IDs select existing 1..988 table rows; unknown physical-code conversion is never invented.",
  "type": "object",
  "additionalProperties": false,
  "properties": {
    "$schema": {
      "type": "string"
    },
    "extends": {
      "oneOf": [
        {
          "type": "integer",
          "enum": [2, 3, 4, 5, 6, 7]
        },
        {
          "type": "string",
          "minLength": 1,
          "pattern": "\\.[yY][kK][iI]$"
        }
      ]
    },
    "version": {
      "type": "integer",
      "minimum": 0,
      "maximum": 10,
      "description": "Selects built-in spoken-version ID 0x40 + version. Not a proven firmware identity."
    },
    "output": {
      "type": "string",
      "minLength": 1
    },
    "mappingPolicy": {
      "enum": ["warn", "strict"],
      "default": "warn"
    },
    "audio": {
      "$ref": "#/$defs/audioOptions"
    },
    "overrides": {
      "type": "array",
      "items": {
        "$ref": "#/$defs/override"
      }
    }
  },
  "required": ["extends", "overrides"],
  "$defs": {
    "id": {
      "oneOf": [
        {
          "type": "integer",
          "minimum": 1,
          "maximum": 988
        },
        {
          "type": "string",
          "pattern": "^[Bb][0-9]{1,3}$"
        },
        {
          "type": "string",
          "pattern": "^(0[xX])?[0-9a-fA-F]{4}$",
          "not": {
            "type": "string",
            "pattern": "^[Bb][0-9]{1,3}$"
          }
        },
        {
          "type": "array",
          "minItems": 4,
          "maxItems": 4,
          "items": {
            "type": "string",
            "pattern": "^[01]{4}$"
          }
        },
        {
          "type": "object",
          "additionalProperties": false,
          "properties": {
            "medal": {
              "type": "integer",
              "minimum": 1,
              "maximum": 988
            }
          },
          "required": ["medal"]
        },
        {
          "type": "object",
          "additionalProperties": false,
          "properties": {
            "bumpsHex": {
              "type": "string",
              "pattern": "^(0[xX])?[0-9a-fA-F]{4}$"
            }
          },
          "required": ["bumpsHex"]
        },
        {
          "type": "object",
          "additionalProperties": false,
          "properties": {
            "bumps": {
              "type": "array",
              "minItems": 4,
              "maxItems": 4,
              "items": {
                "type": "string",
                "pattern": "^[01]{4}$"
              }
            }
          },
          "required": ["bumps"]
        },
        {
          "type": "object",
          "additionalProperties": false,
          "properties": {
            "sound": {
              "type": "integer",
              "minimum": 0,
              "maximum": 65533
            },
            "namespace": {
              "enum": ["builtin", "resource"],
              "default": "builtin"
            },
            "field": {
              "enum": [
                "summonSound",
                "tribeSound",
                "nameSound",
                "introSound",
                "postSound",
                "callSound",
                "songSound"
              ],
              "default": "nameSound"
            },
            "medal": {
              "type": "integer",
              "minimum": 1,
              "maximum": 988
            }
          },
          "required": ["sound"]
        }
      ]
    },
    "sound": {
      "oneOf": [
        {
          "type": "null"
        },
        {
          "type": "string",
          "minLength": 1
        },
        {
          "type": "object",
          "additionalProperties": false,
          "properties": {
            "file": {
              "type": "string",
              "minLength": 1
            },
            "frameAlignment": {
              "enum": ["trim", "pad", "error"],
              "default": "trim"
            },
            "volume": {
              "enum": ["preserve", "peak", "match"],
              "default": "preserve"
            },
            "allowClipping": {
              "type": "boolean",
              "default": false
            },
            "referenceResource": {
              "type": "integer",
              "minimum": 2,
              "maximum": 65534
            }
          },
          "required": ["file"]
        },
        {
          "type": "object",
          "additionalProperties": false,
          "properties": {
            "builtin": {
              "type": "integer",
              "minimum": 0,
              "maximum": 65533
            }
          },
          "required": ["builtin"]
        },
        {
          "type": "object",
          "additionalProperties": false,
          "properties": {
            "resource": {
              "type": "integer",
              "minimum": 2,
              "maximum": 65534
            }
          },
          "required": ["resource"]
        }
      ]
    },
    "led": {
      "oneOf": [
        {
          "type": "null"
        },
        {
          "type": "string",
          "minLength": 1
        },
        {
          "type": "object",
          "additionalProperties": false,
          "properties": {
            "frames": {
              "type": "array",
              "minItems": 1,
              "maxItems": 100000,
              "items": {
                "type": "array",
                "minItems": 3,
                "maxItems": 3,
                "items": {
                  "type": "integer",
                  "minimum": 0,
                  "maximum": 255
                }
              }
            },
            "repeat": {
              "type": "integer",
              "minimum": 1,
              "maximum": 1024,
              "default": 1
            }
          },
          "required": ["frames"]
        },
        {
          "type": "object",
          "additionalProperties": false,
          "properties": {
            "resource": {
              "type": "integer",
              "minimum": 2,
              "maximum": 65534
            },
            "repeat": {
              "type": "integer",
              "minimum": 1,
              "maximum": 1024,
              "default": 1
            }
          },
          "required": ["resource"]
        }
      ]
    },
    "override": {
      "type": "object",
      "additionalProperties": false,
      "properties": {
        "id": {
          "$ref": "#/$defs/id"
        },
        "type": {
          "enum": ["normal", "song"]
        },
        "template": {
          "oneOf": [
            {
              "type": "integer",
              "minimum": 1,
              "maximum": 988
            },
            {
              "type": "string",
              "pattern": "^[Bb][0-9]{1,3}$"
            }
          ]
        },
        "led": {
          "$ref": "#/$defs/led"
        },
        "summonSound": {
          "$ref": "#/$defs/sound"
        },
        "tribeSound": {
          "$ref": "#/$defs/sound"
        },
        "nameSound": {
          "$ref": "#/$defs/sound"
        },
        "introSound": {
          "$ref": "#/$defs/sound"
        },
        "postSound": {
          "$ref": "#/$defs/sound"
        },
        "callSound": {
          "$ref": "#/$defs/sound"
        },
        "songSound": {
          "$ref": "#/$defs/sound"
        }
      },
      "required": ["id"],
      "allOf": [
        {
          "if": {
            "required": ["type"],
            "properties": {
              "type": {
                "const": "normal"
              }
            }
          },
          "then": {
            "not": {
              "required": ["songSound"]
            }
          }
        }
      ]
    },
    "audioOptions": {
      "type": "object",
      "additionalProperties": false,
      "properties": {
        "frameAlignment": {
          "enum": ["trim", "pad", "error"],
          "default": "trim"
        },
        "volume": {
          "enum": ["preserve", "peak", "match"],
          "default": "preserve"
        },
        "allowClipping": {
          "type": "boolean",
          "default": false
        },
        "referenceResource": {
          "type": "integer",
          "minimum": 2,
          "maximum": 65534
        }
      },
      "required": []
    }
  }
}
